<?xml version="1.0" encoding="UTF-8"?>
<universityCardList xmlns:xsi="http://www.w3.org/2001/XMLSchema-instance"
                    xsi:noNamespaceSchemaLocation="universityCardList.xsd">
    <universityCard>
        <university>UNIVERSIDAD NACIONAL MAYOR DE SAN MARCOS</university>
        <code>15200134</code>
        <dni>76517361</dni>
        <lastName>CUADROS RAMOS</lastName>
        <firstName>KENT JHUNIOR</firstName>
        <faculty>INGENIERÍA DE SISTEMAS E INFORMÁTICA</faculty>
        <career>INGENIERIA DE SOFTWARE</career>
        <year>2021</year>
        <incomeYear>2021-2</incomeYear>
        <expirationDate>23-12-2022</expirationDate>
    </universityCard>
    <universityCard>
        <university>UNIVERSIDAD NACIONAL MAYOR DE SAN MARCOS</university>
        <code>17200133</code>
        <dni>76517368</dni>
        <lastName>ARMAS ABT</lastName>
        <firstName>MIGUEL RODRIGO</firstName>
        <faculty>INGENIERÍA DE SISTEMAS E INFORMÁTICA</faculty>
        <career>INGENIERIA DE SISTEMAS</career>
        <year>2021</year>
        <incomeYear>2021-2</incomeYear>
        <expirationDate>23-12-2022</expirationDate>
    </universityCard>
    <universityCard>
        <university>UNIVERSIDAD NACIONAL MAYOR DE SAN MARCOS</university>
        <code>17200134</code>
        <dni>76517369</dni>
        <lastName>BOADA CAJO</lastName>
        <firstName>EDINSON PAOLO</firstName>
        <faculty>INGENIERÍA DE SISTEMAS E INFORMÁTICA</faculty>
        <career>INGENIERIA DE SISTEMAS</career>
        <year>2021</year>
        <incomeYear>2021-2</incomeYear>
        <expirationDate>23-12-2022</expirationDate>
    </universityCard>
    <universityCard>
        <university>UNIVERSIDAD NACIONAL MAYOR DE SAN MARCOS</university>
        <code>15200134</code>
        <dni>76517361</dni>
        <lastName>CUADROS RAMOS</lastName>
        <firstName>KENT JHUNIOR</firstName>
        <faculty>INGENIERÍA DE SISTEMAS E INFORMÁTICA</faculty>
        <career>INGENIERIA DE SISTEMAS</career>
        <year>2021</year>
        <incomeYear>2021-2</incomeYear>
        <expirationDate>23-12-2022</expirationDate>
    </universityCard>
</universityCardList>
